{
  "source_id": "SRC-000001",
  "source_type": "museum_record",
  "title": "National Museum, New Delhi — Seal Catalog Entry 81",
  "creator": "National Museum, New Delhi",
  "date": "1931",
  "url": null,
  "repository": "National Museum, New Delhi",
  "citation": "Marshall, J. (1931). Mohenjo-daro and the Indus Civilization.",
  "rights": "Public domain (pre-1931 publication)",
  "notes": "Primary catalog record referenced by ART-000001."
}
